{
  "$schema": "../schemas/program-state.schema.json",
  "schema_version": "1.0.0",
  "program_version": "1.0.0",
  "updated_at": "2026-09-14T00:00:00Z",
  "session_id": "AURA-SP-033-SYNTHETIC-ACCEPTED-20260903",
  "repository": {
    "full_name": "mustafaras/AURA-Local-Voice-Agent-Premium-Pack",
    "default_branch": "main",
    "active_branch": "main",
    "verified_head": "dde18112e5f91a38335468aa33e1d036fcf64c19",
    "remote_head": "dde18112e5f91a38335468aa33e1d036fcf64c19",
    "working_tree_state": "clean",
    "user_owned_changes": []
  },
  "program_status": "blocked",
  "active_prompt": {
    "id": "SP-033",
    "file": "archive/runtime-completion/prompts/second_pass/SP-033_FINAL_CLOSEOUT_RECONCILIATION.prompt.md",
    "state": "completed",
    "step": "SP-000-SP-033 chain terminal COMPLETE under ADR-053 synthetic-accepted scope (owner-instructed 2026-09-03); release/beta-readiness/release_candidate remain blocked (ADR-049). 2026-09-10: UI-0+UI-1 (ui-improvement-plan) delivered on owner go-ahead: committed 57957bc, ledger 8a0e99c, release bundle stable-signed+verified+launch-smoked; /Applications install pending at record time; G1-4 live driver leg open."
  },
  "tracks": [
    {
      "id": "R0",
      "name": "Repository Truth and Governance Repair",
      "state": "completed",
      "dependencies": [],
      "started_at": null,
      "completed_at": "2026-08-02T14:26:47Z",
      "evidence_ids": [
        "EV-SP-031-20260902-CLOSEOUT-OWNER-APPROVAL-01",
        "EV-SP-031-20260902-OWNER-LOCAL-ONLY-APPROVAL-01",
        "EV-BOOTSTRAP-20260802-STATE-RECONCILE-01",
        "EV-BOOTSTRAP-20260802-SCHEMA-VALIDATE-01",
        "EV-BOOTSTRAP-20260802-REPOSITORY-STATE-01",
        "EV-BOOTSTRAP-20260802-SCHEMA-MANIFEST-01",
        "EV-BOOTSTRAP-20260802-TOOLCHAIN-INVENTORY-01",
        "EV-R0-20260802-FULL-SUITE-01",
        "EV-R0-20260802-FULL-SUITE-RERUN-01",
        "EV-R0-20260802-APP-SMOKE-01",
        "EV-R0-20260802-CAPABILITY-AUDIT-01",
        "EV-R0-20260802-STATE-VALIDATOR-01",
        "EV-R0-20260802-TOOLCHAIN-MANIFEST-01",
        "EV-R0-20260802-CI-CONFIG-01",
        "EV-R0-20260802-LEGACY-REDIRECT-01",
        "EV-R0-20260802-TODO-AUDIT-01"
      ],
      "open_risk_ids": [
        "RISK-TOOLCHAIN-PREVIEW"
      ]
    },
    {
      "id": "R1",
      "name": "Runtime Integration Spine and Trace Correctness",
      "state": "completed",
      "dependencies": [
        "R0"
      ],
      "started_at": "2026-08-02T14:10:00Z",
      "completed_at": "2026-08-02T16:34:12Z",
      "evidence_ids": [
        "EV-R1-20260802-FULL-SUITE-01",
        "EV-R1-20260802-TRACE-HEALTH-01",
        "EV-R1-20260802-GOVERNANCE-CLOSEOUT-01",
        "EV-R1-20260802-HEALTH-DETAIL-01",
        "EV-R1-20260802-PLAN-BINDING-01",
        "EV-R1-20260802-AUDIO-CLEANUP-01",
        "EV-R1-20260802-FULL-SUITE-FINAL-01"
      ],
      "open_risk_ids": [
        "RISK-FALSE-SUCCESS",
        "RISK-CONFIRMATION-RESUME"
      ]
    },
    {
      "id": "R2",
      "name": "Bilingual NLU and Dialogue",
      "state": "in_progress",
      "dependencies": [
        "R1"
      ],
      "started_at": "2026-08-02T17:27:28Z",
      "completed_at": null,
      "evidence_ids": [
        "EV-R2-20260802-FOCUSED-INTENT-DIALOGUE-01",
        "EV-R2-20260802-OLLAMA-STRUCTURED-01",
        "EV-R2-20260802-INTEGRATION-DIALOGUE-01",
        "EV-R2-20260802-FULL-SUITE-SLICE-01",
        "EV-R2-20260802-FULL-SUITE-FINAL-01",
        "EV-R2-20260802-FULL-SUITE-FINAL-02",
        "EV-R2-20260802-DIALOGUE-HEALTH-01",
        "EV-R2-20260802-AGENT-RISK-01",
        "EV-R2-20260802-TODO-AUDIT-01",
        "EV-R2-20260802-LOCAL-MODEL-INVENTORY-01",
        "EV-R2-20260802-FULL-SUITE-FINAL-03",
        "EV-R2-20260803-FINAL-REGRESSION-01",
        "EV-R2-20260803-PUBLICATION-01",
        "EV-R2-20260803-OLLAMA-LIVE-BENCHMARK-01",
        "EV-R2-20260803-APP-LAUNCH-LIVE-01",
        "EV-R2-20260803-TEXTDEMO-LIVE-01",
        "EV-R2-20260803-TEXTDEMO-LIVE-02",
        "EV-R2-20260803-PROMPT-LEAKAGE-FIX-01",
        "EV-R2-20260803-REAL-DESKTOP-SESSION-01",
        "EV-R2-20260803-OLLAMA-BUDGET-FIX-01",
        "EV-R2-20260804-STRUCTURED-NLU-CAPABILITY-GATE-FIX-01",
        "EV-R2-20260804-PTT-PERMISSION-AUDIT-01",
        "EV-R2-20260807-STRUCTURED-NLU-SUBFINDING3-ACCEPT-01"
      ],
      "open_risk_ids": [
        "RISK-ENGLISH-ONLY-INTENT",
        "RISK-MODEL-MEMORY-PRESSURE",
        "RISK-STRUCTURED-NLU-MODEL-QUALITY",
        "RISK-STT-MIC-NOT-CAPTURING"
      ]
    },
    {
      "id": "R3",
      "name": "Capability Registry and Typed Planner",
      "state": "in_progress",
      "dependencies": [
        "R2"
      ],
      "started_at": "2026-08-04T10:40:00Z",
      "completed_at": null,
      "evidence_ids": [
        "EV-R3-20260804-CAPABILITY-REGISTRY-PLANNER-01"
      ],
      "open_risk_ids": [
        "RISK-CLOSED-TOOL-ROUTER"
      ]
    },
    {
      "id": "R4",
      "name": "Computer-Use Productization",
      "state": "in_progress",
      "dependencies": [
        "R3"
      ],
      "started_at": "2026-08-07T02:00:00Z",
      "completed_at": null,
      "evidence_ids": [
        "EV-R4-20260807-PRODUCTIZATION-CORE-01",
        "EV-R4-20260807-WIRING-REGISTRY-01"
      ],
      "open_risk_ids": [
        "RISK-NO-PRODUCTION-COMPUTER-USE-PLANNER"
      ]
    },
    {
      "id": "R5",
      "name": "Browser, Mail, Calendar, and Contacts Adapters",
      "state": "in_progress",
      "dependencies": [
        "R3"
      ],
      "started_at": "2026-08-07T05:00:00Z",
      "completed_at": null,
      "evidence_ids": [
        "EV-R5-20260808-READ-FIRST-ADAPTERS-01",
        "EV-SP-010-20260817-COMPOSITION-01",
        "EV-SP-011-20260818-LIVE-ACCEPTANCE-BLOCKED-01",
        "EV-SP-011-20260818-LIVE-LAUNCH-DEGRADED-02",
        "EV-SP-011-20260818-LIVE-RETRY-03",
        "EV-SP-011-20260818-COMPUTER-UI-PREFLIGHT-04",
        "EV-SP-011-20260818-COMPUTER-UI-SCOPE-05",
        "EV-SP-011-20260818-OAUTH-RETRY-06",
        "EV-SP-011-20260819-LIVE-GMAIL-CLOSEOUT-07",
        "EV-SP-011-20260819-NATIVE-LEGS-AND-EXTENSION-08",
        "EV-SP-011-20260819-SAFARI-TRUST-PATH-09",
        "EV-SP-011-20260819-ASYMMETRIC-BRIDGE-10",
        "EV-SP-011-20260819-LAUNCH-AND-HARNESS-11",
        "EV-SP-011-20260819-LIVE-BROWSER-AND-CONTACTS-12",
        "EV-SP-011-20260820-CALENDAR-IDENTITY-AND-FREE-WINDOW-13"
      ],
      "open_risk_ids": [
        "RISK-INDIRECT-PROMPT-INJECTION",
        "RISK-OAUTH-OVERPRIVILEGE",
        "RISK-SAFARI-BRIDGE-NOT-LIVE",
        "RISK-SP-010-LIVE-OAUTH-TCC",
        "RISK-SP-010-NATIVE-MESSAGING-LIVE"
      ]
    },
    {
      "id": "R6",
      "name": "VS Code and Coding-Agent Completion",
      "state": "in_progress",
      "dependencies": [
        "R3"
      ],
      "started_at": "2026-08-08T11:05:00Z",
      "completed_at": null,
      "evidence_ids": [
        "EV-R6-20260808-POLICY-BRIDGE-01",
        "EV-R6-20260808-TYPED-ROUTES-02",
        "EV-SP-012-20260820-DETERMINISTIC-BRIDGE-01",
        "EV-SP-012-20260821-LIVE-ACCEPTANCE-02",
        "EV-SP-013-20260821-COORDINATOR-ROUTING-01"
      ],
      "open_risk_ids": [
        "RISK-VSCODE-POLICY-NOT-ENFORCED",
        "RISK-BRIDGE-INCOMPLETE",
        "RISK-AGENT-BACKEND-DRIFT"
      ]
    },
    {
      "id": "R7",
      "name": "Wake Word, STT/TTS Routing, and Resource Governor",
      "state": "in_progress",
      "dependencies": [
        "R2"
      ],
      "started_at": "2026-08-08T12:43:10Z",
      "completed_at": null,
      "evidence_ids": [
        "EV-R7-20260802-SYSTEM-TTS-SERIALIZE-01",
        "EV-R7-20260808-VOICE-LOCAL-SAFETY-01",
        "EV-R7-20260808-LOCAL-APP-DEPLOY-01",
        "EV-SP-017-20260823-GOVERNOR-IDLE-UNLOAD-01",
        "EV-SP-017-20260823-FULL-SUITE-01",
        "EV-SP-017-20260823-LIVE-SYSTEM-TTS-01",
        "EV-SP-017-20260823-RESOURCE-SCOPE-02",
        "EV-SP-017-20260823-CLOSEOUT-03"
      ],
      "open_risk_ids": [
        "RISK-NO-REAL-WAKE-WORD",
        "RISK-MODEL-MEMORY-PRESSURE",
        "RISK-NEURAL-TTS-LATENCY",
        "RISK-STT-ROUTER-QUALITY",
        "RISK-VOICE-RECOVERY-LIVE"
      ]
    },
    {
      "id": "R8",
      "name": "Memory, Personalization, and Explainability",
      "state": "in_progress",
      "dependencies": [
        "R2",
        "R3"
      ],
      "started_at": "2026-08-08T14:13:21Z",
      "completed_at": null,
      "evidence_ids": [
        "EV-R8-20260808-MEMORY-POLICY-01",
        "EV-R8-20260808-CONTEXT-PRODUCT-02",
        "EV-R8-20260808-REGRESSION-03",
        "EV-SP-018-20260823-PRODUCTION-REFERENCE-WIRING-01",
        "EV-SP-018-20260823-FOCUSED-TESTS-02",
        "EV-SP-018-20260823-FULL-SUITE-03",
        "EV-SP-018-20260823-GOVERNANCE-CLOSEOUT-04",
        "EV-SP-018-20260824-TEST-RUNNER-FIX-06",
        "EV-SP-019-20260824-LOCAL-CONTROLS-01",
        "EV-SP-019-20260824-LAUNCH-SMOKE-02",
        "EV-SP-019-20260824-LIVE-CONTROLS-04",
        "EV-SP-019-20260824-LIVE-CONTROLS-06",
        "EV-SP-019-20260824-CLOSEOUT-07",
        "EV-SP-019-20260825-CONSOLIDATED-ACCEPTANCE-14",
        "EV-SP-020-20260825-REMOTE-BOUNDARY-01",
        "EV-SP-020-20260825-CLOSEOUT-02"
      ],
      "open_risk_ids": [
        "RISK-MEMORY-NOT-PRODUCTIZED",
        "RISK-MEMORY-LIVE-ACCEPTANCE",
        "RISK-MEMORY-REFERENCE-WIRING"
      ]
    },
    {
      "id": "R9",
      "name": "Product UI, Accessibility, and Onboarding",
      "state": "in_progress",
      "dependencies": [
        "R4",
        "R5",
        "R6",
        "R7",
        "R8"
      ],
      "started_at": "2026-08-08T15:28:28Z",
      "completed_at": null,
      "evidence_ids": [
        "EV-R9-20260808-UI-SLICE-START-01",
        "EV-R9-20260808-UI-BUILD-02",
        "EV-R9-20260808-UI-TESTS-03",
        "EV-R9-20260808-UI-REGRESSION-05",
        "EV-R9-20260808-GAPS-04",
        "EV-R9-20260808-FAIL-CLOSED-06",
        "EV-R9-20260809-DELIVERY-07",